{
  "$schema": "./schema/skills.schema.json",
  "version": "1.0.0",
  "updated": "2026-02-14",
  "notes": [
    "path is relative to the repository root and must contain a SKILL.md.",
    "agents lists the agent ids (see agents.json) for which the adapter has a defined transform.",
    "depends lists skill ids that should be installed alongside this skill for it to be fully effective.",
    "tools are optional external tools the skill can use when available; they are never required.",
    "Installing a skill only writes instruction files. No skill content is executed."
  ],
  "skills": [
    {
      "id": "frontend-architecture",
      "name": "Frontend Architecture",
      "description": "Understand and respect existing frontend structure before changing code, and keep components, state, and data access appropriately separated.",
      "category": "frontend",
      "version": "1.0.0",
      "path": "skills/frontend/frontend-architecture/SKILL.md",
      "agents": [
        "codex",
        "claude-code",
        "cursor",
        "github-copilot",
        "windsurf",
        "cline",
        "roo-code",
        "gemini-cli",
        "continue",
        "opencode",
        "hermes",
        "universal"
      ],
      "depends": [],
      "tools": []
    },
    {
      "id": "react-best-practices",
      "name": "React Best Practices",
      "description": "Apply sound React component boundaries, hook usage, state placement, and rendering behavior while following the project's existing React version.",
      "category": "frontend",
      "version": "1.0.0",
      "path": "skills/frontend/react-best-practices/SKILL.md",
      "agents": [
        "codex",
        "claude-code",
        "cursor",
        "github-copilot",
        "windsurf",
        "cline",
        "roo-code",
        "gemini-cli",
        "continue",
        "opencode",
        "hermes",
        "universal"
      ],
      "depends": [
        "frontend-architecture"
      ],
      "tools": []
    },
    {
      "id": "responsive-design",
      "name": "Responsive Design",
      "description": "Build layouts that work across viewport sizes, handle overflow and text wrapping, and keep mobile navigation usable.",
      "category": "frontend",
      "version": "1.0.0",
      "path": "skills/frontend/responsive-design/SKILL.md",
      "agents": [
        "codex",
        "claude-code",
        "cursor",
        "github-copilot",
        "windsurf",
        "cline",
        "roo-code",
        "gemini-cli",
        "continue",
        "opencode",
        "hermes",
        "universal"
      ],
      "depends": [],
      "tools": []
    },
    {
      "id": "accessibility-a11y",
      "name": "Accessibility (a11y)",
      "description": "Use semantic HTML, keyboard support, accessible names, and correct ARIA only where native semantics are insufficient.",
      "category": "frontend",
      "version": "1.0.0",
      "path": "skills/frontend/accessibility-a11y/SKILL.md",
      "agents": [
        "codex",
        "claude-code",
        "cursor",
        "github-copilot",
        "windsurf",
        "cline",
        "roo-code",
        "gemini-cli",
        "continue",
        "opencode",
        "hermes",
        "universal"
      ],
      "depends": [],
      "tools": [
        "axe",
        "eslint-plugin-jsx-a11y"
      ]
    },
    {
      "id": "frontend-performance",
      "name": "Frontend Performance",
      "description": "Make evidence-based frontend performance decisions about bundles, images, fonts, caching, and rendering.",
      "category": "frontend",
      "version": "1.0.0",
      "path": "skills/frontend/frontend-performance/SKILL.md",
      "agents": [
        "codex",
        "claude-code",
        "cursor",
        "github-copilot",
        "windsurf",
        "cline",
        "roo-code",
        "gemini-cli",
        "continue",
        "opencode",
        "hermes",
        "universal"
      ],
      "depends": [],
      "tools": [
        "lighthouse"
      ]
    },
    {
      "id": "design-system",
      "name": "Design System",
      "description": "Define and reuse color, type, spacing, radius, shadow, and state tokens instead of scattering arbitrary values.",
      "category": "frontend",
      "version": "1.0.0",
      "path": "skills/frontend/design-system/SKILL.md",
      "agents": [
        "codex",
        "claude-code",
        "cursor",
        "github-copilot",
        "windsurf",
        "cline",
        "roo-code",
        "gemini-cli",
        "continue",
        "opencode",
        "hermes",
        "universal"
      ],
      "depends": [],
      "tools": []
    },
    {
      "id": "frontend-form-engineering",
      "name": "Frontend Form Engineering",
      "description": "Build forms with clear validation, accessible errors, loading and disabled states, and protection against duplicate submission.",
      "category": "frontend",
      "version": "1.0.0",
      "path": "skills/frontend/frontend-form-engineering/SKILL.md",
      "agents": [
        "codex",
        "claude-code",
        "cursor",
        "github-copilot",
        "windsurf",
        "cline",
        "roo-code",
        "gemini-cli",
        "continue",
        "opencode",
        "hermes",
        "universal"
      ],
      "depends": [
        "accessibility-a11y"
      ],
      "tools": []
    },
    {
      "id": "animation-and-interaction",
      "name": "Animation and Interaction",
      "description": "Add purposeful transitions and feedback while respecting reduced-motion preferences and avoiding distraction.",
      "category": "frontend",
      "version": "1.0.0",
      "path": "skills/frontend/animation-and-interaction/SKILL.md",
      "agents": [
        "codex",
        "claude-code",
        "cursor",
        "github-copilot",
        "windsurf",
        "cline",
        "roo-code",
        "gemini-cli",
        "continue",
        "opencode",
        "hermes",
        "universal"
      ],
      "depends": [
        "accessibility-a11y"
      ],
      "tools": []
    },
    {
      "id": "api-design",
      "name": "API Design",
      "description": "Design HTTP APIs with clear semantics, correct status codes, validation, pagination, and consistent error shapes.",
      "category": "backend",
      "version": "1.0.0",
      "path": "skills/backend/api-design/SKILL.md",
      "agents": [
        "codex",
        "claude-code",
        "cursor",
        "github-copilot",
        "windsurf",
        "cline",
        "roo-code",
        "gemini-cli",
        "continue",
        "opencode",
        "hermes",
        "universal"
      ],
      "depends": [],
      "tools": []
    },
    {
      "id": "database-design",
      "name": "Database Design",
      "description": "Choose data types, keys, indexes, and transaction boundaries deliberately, and keep migrations safe.",
      "category": "backend",
      "version": "1.0.0",
      "path": "skills/backend/database-design/SKILL.md",
      "agents": [
        "codex",
        "claude-code",
        "cursor",
        "github-copilot",
        "windsurf",
        "cline",
        "roo-code",
        "gemini-cli",
        "continue",
        "opencode",
        "hermes",
        "universal"
      ],
      "depends": [],
      "tools": []
    },
    {
      "id": "authentication-authorization",
      "name": "Authentication and Authorization",
      "description": "Separate authentication from authorization, enforce least privilege and ownership checks, and handle sessions and tokens safely.",
      "category": "backend",
      "version": "1.0.0",
      "path": "skills/backend/authentication-authorization/SKILL.md",
      "agents": [
        "codex",
        "claude-code",
        "cursor",
        "github-copilot",
        "windsurf",
        "cline",
        "roo-code",
        "gemini-cli",
        "continue",
        "opencode",
        "hermes",
        "universal"
      ],
      "depends": [],
      "tools": []
    },
    {
      "id": "secure-backend",
      "name": "Secure Backend",
      "description": "Validate input, encode output, prevent injection, limit rates, and handle secrets, uploads, and errors safely.",
      "category": "backend",
      "version": "1.0.0",
      "path": "skills/backend/secure-backend/SKILL.md",
      "agents": [
        "codex",
        "claude-code",
        "cursor",
        "github-copilot",
        "windsurf",
        "cline",
        "roo-code",
        "gemini-cli",
        "continue",
        "opencode",
        "hermes",
        "universal"
      ],
      "depends": [
        "data-validation-and-integrity"
      ],
      "tools": []
    },
    {
      "id": "backend-architecture",
      "name": "Backend Architecture",
      "description": "Place domain logic, boundaries, configuration, and error handling sensibly without over-engineering small applications.",
      "category": "backend",
      "version": "1.0.0",
      "path": "skills/backend/backend-architecture/SKILL.md",
      "agents": [
        "codex",
        "claude-code",
        "cursor",
        "github-copilot",
        "windsurf",
        "cline",
        "roo-code",
        "gemini-cli",
        "continue",
        "opencode",
        "hermes",
        "universal"
      ],
      "depends": [],
      "tools": []
    },
    {
      "id": "integration-engineering",
      "name": "Integration Engineering",
      "description": "Call external services reliably with timeouts, retries, backoff, idempotency, and webhook verification.",
      "category": "backend",
      "version": "1.0.0",
      "path": "skills/backend/integration-engineering/SKILL.md",
      "agents": [
        "codex",
        "claude-code",
        "cursor",
        "github-copilot",
        "windsurf",
        "cline",
        "roo-code",
        "gemini-cli",
        "continue",
        "opencode",
        "hermes",
        "universal"
      ],
      "depends": [],
      "tools": []
    },
    {